{
  "$id": "urn:agent-hook-kit:contracts:claude-code:docs-2026-08-05-r1:pre-tool-use:input",
  "$schema": "https://json-schema.org/draft/2020-12/schema",
  "additionalProperties": true,
  "properties": {
    "agent_id": {
      "type": "string"
    },
    "agent_type": {
      "type": "string"
    },
    "cwd": {
      "type": "string"
    },
    "effort": {
      "additionalProperties": false,
      "properties": {
        "level": {
          "enum": [
            "low",
            "medium",
            "high",
            "xhigh",
            "max"
          ]
        }
      },
      "required": [
        "level"
      ],
      "type": "object"
    },
    "hook_event_name": {
      "const": "PreToolUse"
    },
    "permission_mode": {
      "enum": [
        "default",
        "plan",
        "acceptEdits",
        "auto",
        "dontAsk",
        "bypassPermissions"
      ]
    },
    "prompt_id": {
      "type": "string"
    },
    "session_id": {
      "type": "string"
    },
    "tool_input": {},
    "tool_name": {
      "type": "string"
    },
    "tool_use_id": {
      "type": "string"
    },
    "transcript_path": {
      "type": "string"
    }
  },
  "required": [
    "session_id",
    "transcript_path",
    "cwd",
    "hook_event_name",
    "tool_name",
    "tool_input",
    "tool_use_id"
  ],
  "type": "object"
}
